{
    "$schema": "http://json-schema.org/draft-07/schema#",
    "$id": "urn:plasmazones:schema:layout",
    "title": "PlasmaZones Layout",
    "description": "A tiling layout with identity metadata and a list of zones with relative geometry. Structural invariants are enforced here. The optional appearance, gap, geometry-mode, and visibility keys are allowed through so editor-produced and future layouts are not rejected.",
    "type": "object",
    "required": ["id", "name", "zones"],
    "properties": {
        "id": {
            "type": "string",
            "minLength": 1,
            "description": "Stable layout identity. Built-in layouts use a brace-wrapped UUID."
        },
        "name": {
            "type": "string",
            "minLength": 1,
            "description": "Display name. The loader rejects layouts with an empty name."
        },
        "description": { "type": "string" },
        "type": {
            "type": "integer",
            "minimum": 0,
            "description": "Layout-type enum (Grid, Columns, Rows, BSP, ...)."
        },
        "isSystem": { "type": "boolean" },
        "showZoneNumbers": { "type": "boolean" },
        "defaultOrder": { "type": "integer" },
        "aspectRatioClass": {
            "oneOf": [
                { "type": "string", "enum": ["any", "standard", "ultrawide", "super-ultrawide", "portrait"] },
                { "type": "integer", "minimum": 0, "maximum": 4 }
            ],
            "description": "Aspect-ratio bucket the layout targets. Both serialized forms are on the wire and readers accept either: Layout::toJson emits the canonical string, while the editor's save round-trip carries the raw enum int. Omitting the key means Any."
        },
        "zones": {
            "type": "array",
            "minItems": 1,
            "description": "At least one zone. The loader rejects zero-zone layouts.",
            "items": { "$ref": "#/definitions/zone" }
        }
    },
    "definitions": {
        "zone": {
            "type": "object",
            "required": ["relativeGeometry"],
            "properties": {
                "id": { "type": "string", "minLength": 1 },
                "name": { "type": "string" },
                "zoneNumber": { "type": "integer" },
                "relativeGeometry": { "$ref": "#/definitions/relativeGeometry" }
            }
        },
        "relativeGeometry": {
            "type": "object",
            "description": "Screen-relative rectangle in the range 0.0-1.0. Width and height must be positive.",
            "required": ["x", "y", "width", "height"],
            "additionalProperties": false,
            "properties": {
                "x": { "type": "number", "minimum": 0, "maximum": 1 },
                "y": { "type": "number", "minimum": 0, "maximum": 1 },
                "width": { "type": "number", "exclusiveMinimum": 0, "maximum": 1 },
                "height": { "type": "number", "exclusiveMinimum": 0, "maximum": 1 }
            }
        }
    }
}
