{
    "id": "{c6619bf8-7ed7-4bdc-865d-36028fcb7462}",
    "name": "Rows (2)",
    "description": "Two equal horizontal rows",
    "type": 2,
    "showZoneNumbers": true,
    "aspectRatioClass": "standard",
    "zones": [
        {
            "id": "{a17d6c7f-911a-4966-8043-6398cacbf763}",
            "name": "Top",
            "zoneNumber": 1,
            "relativeGeometry": { "x": 0, "y": 0, "width": 1.0, "height": 0.5 }
        },
        {
            "id": "{ca152543-1095-4d06-9a9d-7be527c8ed2f}",
            "name": "Bottom",
            "zoneNumber": 2,
            "relativeGeometry": { "x": 0, "y": 0.5, "width": 1.0, "height": 0.5 }
        }
    ]
}
