{
    "id": "{a83addbc-1907-45a8-a3d5-59dedf079030}",
    "name": "Wide",
    "description": "Large top area with row of smaller areas below",
    "type": 5,
    "showZoneNumbers": true,
    "aspectRatioClass": "standard",
    "zones": [
        {
            "id": "{27c70418-33e8-480b-bdbc-8b4e8bb8c772}",
            "name": "Main",
            "zoneNumber": 1,
            "relativeGeometry": { "x": 0, "y": 0, "width": 1.0, "height": 0.65 }
        },
        {
            "id": "{6df407a3-3439-46a8-9bd5-aa91b1d95f3a}",
            "name": "Bottom Left",
            "zoneNumber": 2,
            "relativeGeometry": { "x": 0, "y": 0.65, "width": 0.333333, "height": 0.35 }
        },
        {
            "id": "{ade74fcb-7367-46f1-a78f-0fc16b745aa9}",
            "name": "Bottom Center",
            "zoneNumber": 3,
            "relativeGeometry": { "x": 0.333333, "y": 0.65, "width": 0.333334, "height": 0.35 }
        },
        {
            "id": "{c58df21e-a91c-45b2-b3c6-058aaebcb792}",
            "name": "Bottom Right",
            "zoneNumber": 4,
            "relativeGeometry": { "x": 0.666667, "y": 0.65, "width": 0.333333, "height": 0.35 }
        }
    ]
}
