{
    "id": "{2fda280b-728a-4ad6-9969-b94014017ba8}",
    "name": "Master + Stack",
    "description": "Classic tiling layout with 60% master and 40% stacked",
    "type": 5,
    "showZoneNumbers": true,
    "aspectRatioClass": "standard",
    "zones": [
        {
            "id": "{f1be23ab-dd54-4562-afe0-9024be856142}",
            "name": "Master",
            "zoneNumber": 1,
            "relativeGeometry": { "x": 0, "y": 0, "width": 0.6, "height": 1.0 }
        },
        {
            "id": "{9bab6287-4ca2-4148-ba9b-0497cf03c9ca}",
            "name": "Stack 1",
            "zoneNumber": 2,
            "relativeGeometry": { "x": 0.6, "y": 0, "width": 0.4, "height": 0.333333 }
        },
        {
            "id": "{8ac204f9-7668-4aad-9aae-9ceae82dc2a2}",
            "name": "Stack 2",
            "zoneNumber": 3,
            "relativeGeometry": { "x": 0.6, "y": 0.333333, "width": 0.4, "height": 0.333334 }
        },
        {
            "id": "{79e898a5-8382-4936-b70e-9806c625515e}",
            "name": "Stack 3",
            "zoneNumber": 4,
            "relativeGeometry": { "x": 0.6, "y": 0.666667, "width": 0.4, "height": 0.333333 }
        }
    ]
}
